{
  "schemaVersion": 1,
  "id": "csharp-basics",
  "title": "C# – czytanie kodu: podstawy",
  "subject": "csharp",
  "locale": "pl",
  "version": 2,
  "description": "Pułapki C#: typy wartościowe i referencyjne, stringi, LINQ, async.",
  "levels": [
    {
      "number": 1,
      "title": "Wartości i referencje"
    },
    {
      "number": 2,
      "title": "Stringi i równość"
    },
    {
      "number": 3,
      "title": "LINQ"
    },
    {
      "number": 4,
      "title": "async i await"
    }
  ],
  "cards": [
    {
      "id": "cs-val-001",
      "type": "predict_output",
      "level": 1,
      "difficulty": 1,
      "tags": [
        "value-types",
        "struct",
        "class"
      ],
      "prompt": "Co wypisze ten kod?",
      "code": "var p1 = new Point { X = 1 };\nvar p2 = p1;\np2.X = 5;\n\nvar b1 = new Box { X = 1 };\nvar b2 = b1;\nb2.X = 5;\n\nConsole.WriteLine($\"{p1.X} {b1.X}\");\n\nstruct Point { public int X; }\nclass Box { public int X; }",
      "codeLanguage": "csharp",
      "answer": {
        "kind": "choice",
        "options": [
          "1 1",
          "1 5",
          "5 1",
          "5 5"
        ],
        "correct": 1
      },
      "explanation": "Point to struct (typ wartościowy), więc p2 = p1 kopiuje całą wartość i zmiana p2 nie dotyka p1. Box to klasa (typ referencyjny): b1 i b2 wskazują na ten sam obiekt, więc zmianę zrobioną przez b2 widać też przez b1."
    },
    {
      "id": "cs-val-002",
      "type": "predict_output",
      "level": 1,
      "difficulty": 1,
      "tags": [
        "value-types",
        "struct",
        "parameters"
      ],
      "prompt": "Co wypisze ten kod?",
      "code": "var p = new Point { X = 1 };\nMove(p);\nConsole.WriteLine(p.X);\n\nstatic void Move(Point q) => q.X = 10;\n\nstruct Point { public int X; }",
      "codeLanguage": "csharp",
      "answer": {
        "kind": "choice",
        "options": [
          "10",
          "1",
          "0",
          "Błąd kompilacji"
        ],
        "correct": 1
      },
      "explanation": "Struct przekazany do metody jest kopiowany. Move zmienia swoją kopię q, a oryginalne p dalej ma X = 1. Żeby zmienić oryginał, trzeba przekazać go przez ref albo zwrócić nową wartość."
    },
    {
      "id": "cs-val-003",
      "type": "predict_output",
      "level": 1,
      "difficulty": 2,
      "tags": [
        "reference-types",
        "class",
        "parameters"
      ],
      "prompt": "Co wypisze ten kod?",
      "code": "var b = new Box { X = 1 };\nChange(b);\nConsole.WriteLine(b.X);\n\nstatic void Change(Box box)\n{\n    box.X = 2;\n    box = new Box { X = 3 };\n}\n\nclass Box { public int X; }",
      "codeLanguage": "csharp",
      "answer": {
        "kind": "choice",
        "options": [
          "1",
          "3",
          "2",
          "NullReferenceException"
        ],
        "correct": 2
      },
      "explanation": "Do metody trafia kopia referencji. box.X = 2 zmienia wspólny obiekt, więc b to widzi. Potem box = new Box(...) przestawia tylko lokalną kopię referencji na nowy obiekt; zmienna b dalej wskazuje na stary, z X = 2."
    },
    {
      "id": "cs-val-004",
      "type": "predict_output",
      "level": 1,
      "difficulty": 2,
      "tags": [
        "value-types",
        "ref",
        "parameters"
      ],
      "prompt": "Co wypisze ten kod?",
      "code": "int a = 1;\nInc(a);\nIncRef(ref a);\nConsole.WriteLine(a);\n\nstatic void Inc(int x) => x++;\nstatic void IncRef(ref int x) => x++;",
      "codeLanguage": "csharp",
      "answer": {
        "kind": "choice",
        "options": [
          "2",
          "1",
          "3",
          "Błąd kompilacji"
        ],
        "correct": 0
      },
      "explanation": "Inc dostaje kopię int i zwiększa tylko ją. IncRef dostaje ref, czyli alias na zmienną a, więc zwiększa oryginał. Wynik: 1 + 1 = 2."
    },
    {
      "id": "cs-val-005",
      "type": "predict_output",
      "level": 1,
      "difficulty": 2,
      "tags": [
        "value-types",
        "struct",
        "collections"
      ],
      "prompt": "Co wypisze ten kod?",
      "code": "var list = new List<Point> { new Point { X = 1 } };\nvar p = list[0];\np.X = 5;\nConsole.WriteLine(list[0].X);\n\nstruct Point { public int X; }",
      "codeLanguage": "csharp",
      "answer": {
        "kind": "choice",
        "options": [
          "5",
          "0",
          "Błąd kompilacji",
          "1"
        ],
        "correct": 3
      },
      "explanation": "Indekser listy zwraca kopię structa, więc p to osobna wartość i zmiana p.X nie trafia do listy. Bezpośrednie list[0].X = 5 w ogóle się nie skompiluje (CS1612) właśnie z tego powodu. Trzeba zmienić kopię i wpisać ją z powrotem: list[0] = p."
    },
    {
      "id": "cs-str-001",
      "type": "predict_output",
      "level": 2,
      "difficulty": 1,
      "tags": [
        "string",
        "immutability"
      ],
      "prompt": "Co wypisze ten kod?",
      "code": "string s = \"kot\";\ns.ToUpper();\ns.Replace('k', 'p');\nConsole.WriteLine(s);",
      "codeLanguage": "csharp",
      "answer": {
        "kind": "choice",
        "options": [
          "kot",
          "KOT",
          "pot",
          "POT"
        ],
        "correct": 0
      },
      "explanation": "Stringi w C# są niemutowalne. ToUpper() i Replace() zwracają nowe stringi, a tu ich wynik jest wyrzucany. Zmienna s nadal wskazuje na \"kot\". Poprawnie: s = s.ToUpper();"
    },
    {
      "id": "cs-str-002",
      "type": "predict_output",
      "level": 2,
      "difficulty": 1,
      "tags": [
        "string",
        "immutability",
        "reference-types"
      ],
      "prompt": "Co wypisze ten kod?",
      "code": "string a = \"ab\";\nstring b = a;\na += \"c\";\nConsole.WriteLine(b);",
      "codeLanguage": "csharp",
      "answer": {
        "kind": "choice",
        "options": [
          "abc",
          "ab",
          "c",
          "Błąd kompilacji"
        ],
        "correct": 1
      },
      "explanation": "string jest typem referencyjnym, ale niemutowalnym. a += \"c\" nie zmienia istniejącego obiektu, tylko tworzy nowy string \"abc\" i przestawia na niego a. b dalej wskazuje na stare \"ab\"."
    },
    {
      "id": "cs-str-003",
      "type": "predict_output",
      "level": 2,
      "difficulty": 2,
      "tags": [
        "string",
        "equality"
      ],
      "prompt": "Co wypisze ten kod?",
      "code": "string a = \"hello\";\nstring b = new string(\"hello\".ToCharArray());\nConsole.WriteLine($\"{a == b} {(object)a == (object)b}\");",
      "codeLanguage": "csharp",
      "answer": {
        "kind": "choice",
        "options": [
          "True True",
          "False False",
          "True False",
          "False True"
        ],
        "correct": 2
      },
      "explanation": "Dla typu string operator == jest przeciążony i porównuje treść, więc pierwsze to True. Po rzutowaniu na object używany jest == z object, czyli porównanie referencji. new string(...) tworzy osobny obiekt, więc drugie to False."
    },
    {
      "id": "cs-str-004",
      "type": "predict_output",
      "level": 2,
      "difficulty": 3,
      "tags": [
        "string",
        "interning",
        "equality"
      ],
      "prompt": "Co wypisze ten kod?",
      "code": "string a = \"abc\";\nstring b = \"abc\";\nConsole.WriteLine(ReferenceEquals(a, b));",
      "codeLanguage": "csharp",
      "answer": {
        "kind": "choice",
        "options": [
          "False",
          "True",
          "Zależy od trybu Debug/Release",
          "Błąd kompilacji"
        ],
        "correct": 1
      },
      "explanation": "Literały stringów są internowane: ten sam literał w programie to jeden obiekt w pamięci. Dlatego a i b wskazują na ten sam obiekt i ReferenceEquals zwraca True. Stringi zbudowane w czasie działania (np. przez new string albo konkatenację zmiennych) już internowane nie są."
    },
    {
      "id": "cs-str-005",
      "type": "predict_output",
      "level": 2,
      "difficulty": 2,
      "tags": [
        "string",
        "null"
      ],
      "prompt": "Co wypisze ten kod?",
      "code": "string? s = null;\nConsole.WriteLine(s + \"x\");",
      "codeLanguage": "csharp",
      "answer": {
        "kind": "choice",
        "options": [
          "NullReferenceException",
          "nullx",
          "x",
          " x"
        ],
        "correct": 2
      },
      "explanation": "Konkatenacja stringów traktuje null jak pusty string, więc wynik to \"x\". Wyjątek poleciałby dopiero przy wywołaniu metody na null, np. s.Length albo s.ToUpper()."
    },
    {
      "id": "cs-linq-001",
      "type": "predict_output",
      "level": 3,
      "difficulty": 2,
      "tags": [
        "linq",
        "deferred-execution"
      ],
      "prompt": "Co wypisze ten kod?",
      "code": "var list = new List<int> { 1, 2, 3 };\nvar query = list.Where(x => x > 1);\nlist.Add(4);\nConsole.WriteLine(query.Count());",
      "codeLanguage": "csharp",
      "answer": {
        "kind": "choice",
        "options": [
          "2",
          "3",
          "4",
          "Wyjątek InvalidOperationException"
        ],
        "correct": 1
      },
      "explanation": "Where() nie liczy niczego od razu, tylko opisuje zapytanie (opóźnione wykonanie). Filtr wykonuje się dopiero przy Count(), czyli już po dodaniu 4. Elementy > 1 to 2, 3, 4, więc wynik to 3. Żeby zamrozić wynik, użyj ToList() przed list.Add(4)."
    },
    {
      "id": "cs-linq-002",
      "type": "predict_output",
      "level": 3,
      "difficulty": 3,
      "tags": [
        "linq",
        "deferred-execution",
        "multiple-enumeration"
      ],
      "prompt": "Co wypisze ten kod?",
      "code": "int calls = 0;\nvar q = new List<int> { 1, 2, 3 }.Where(x =>\n{\n    calls++;\n    return x > 1;\n});\nvar count = q.Count();\nvar sum = q.Sum();\nConsole.WriteLine(calls);",
      "codeLanguage": "csharp",
      "answer": {